{
  "profile_type": "catalyst-narrative-risk-platform-profile",
  "profile_version": "2.0.0",
  "generated_at": "2026-07-17T19:39:58+00:00",
  "platform_name": "Catalyst Narrative Risk",
  "release_name": "Connected Narrative Risk and Claims Governance Platform",
  "modules": [
    {
      "module": "narrative_risk",
      "status": "connected",
      "role": "claims, evidence, governance, monitoring, and publication authority"
    },
    {
      "module": "knowledge_library",
      "status": "connected",
      "role": "source discovery and publication archive"
    },
    {
      "module": "catalyst_data",
      "status": "connected",
      "role": "dataset provenance and observations"
    },
    {
      "module": "site_intelligence",
      "status": "connected",
      "role": "external monitoring signals"
    },
    {
      "module": "catalyst_canvas",
      "status": "connected",
      "role": "stakeholder and journey context"
    },
    {
      "module": "decision_studio",
      "status": "connected",
      "role": "scenario and decision handoff"
    },
    {
      "module": "research_librarian",
      "status": "connected",
      "role": "guided research routing"
    },
    {
      "module": "workbench",
      "status": "connected",
      "role": "calculation and modeling handoff"
    },
    {
      "module": "catalyst_analytics",
      "status": "connected",
      "role": "statistical analysis handoff"
    },
    {
      "module": "publication_api",
      "status": "connected",
      "role": "public-safe distribution and embeds"
    }
  ],
  "capabilities": [
    "ambiguity-review",
    "approval-expiration",
    "best_base_worst_counterfactual_adversarial_scenarios",
    "briefing_publication",
    "case_retention_assessments",
    "catalyst_canvas_handoff",
    "causality-review",
    "checksummed_integration_routes",
    "claim-decomposition",
    "claim-review-timeline",
    "claim_evidence_matrices",
    "comparative_narrative_sets",
    "comparative_portfolio_dashboard",
    "competing_frames_and_assumptions",
    "conditional-approval",
    "connected_platform_health",
    "connected_platform_profile",
    "cross_module_event_bus",
    "database_integrity_diagnostics",
    "decision_studio_handoff",
    "dependency-cycle-detection",
    "explicit_cors_allowlist",
    "first_party_module_registry",
    "html_markdown_pdf_json_csv_jsonld_exports",
    "idempotent_writes",
    "immutable-monitoring-snapshots",
    "incentive_and_conflict_records",
    "institutional_workspace_rollups",
    "mandatory-reassessment",
    "material-change-analysis",
    "monitoring-alerts",
    "narrative-drift-detection",
    "openapi_contract",
    "parameter_sensitivity_analysis",
    "performance_budgets",
    "platform_publication_handoffs",
    "prediction-boundary-review",
    "pressure_intelligence",
    "privacy_retention_policies",
    "production_readiness_reports",
    "public_embeds",
    "public_safe_briefings",
    "publication-restrictions",
    "publication_packages",
    "rate_limits",
    "reassessment-scheduling",
    "request_size_limits",
    "restore_drills",
    "reviewer-queues",
    "role-based-governance",
    "scoped_api",
    "scoped_api_keys",
    "secure_response_headers",
    "site-intelligence-monitoring-handoff",
    "source-freshness-policy",
    "staged-review",
    "stakeholder_actor_registry",
    "stakeholder_consequence_assessment",
    "stakeholder_relationship_graph",
    "typed-narrative-links",
    "typed-narrative-nodes",
    "unified_case_dossiers",
    "verified_sqlite_backups",
    "watchlists",
    "wording-comparison",
    "wordpress_accessibility_audits"
  ],
  "data_contracts": [
    "https://sustainablecatalyst.com/schemas/narrative-risk/accessibility-report/2.0.0",
    "https://sustainablecatalyst.com/schemas/narrative-risk/api-key/2.0.0",
    "https://sustainablecatalyst.com/schemas/narrative-risk/backup-manifest/2.0.0",
    "https://sustainablecatalyst.com/schemas/narrative-risk/briefing/2.0.0",
    "https://sustainablecatalyst.com/schemas/narrative-risk/case/2.0.0",
    "https://sustainablecatalyst.com/schemas/narrative-risk/comparative-evidence-matrix/2.0.0",
    "https://sustainablecatalyst.com/schemas/narrative-risk/comparative-portfolio/2.0.0",
    "https://sustainablecatalyst.com/schemas/narrative-risk/comparison-set/2.0.0",
    "https://sustainablecatalyst.com/schemas/narrative-risk/connected-dossier/2.0.0",
    "https://sustainablecatalyst.com/schemas/narrative-risk/decision-studio-handoff/2.0.0",
    "https://sustainablecatalyst.com/schemas/narrative-risk/evidence-ledger/2.0.0",
    "https://sustainablecatalyst.com/schemas/narrative-risk/governance-decision/2.0.0",
    "https://sustainablecatalyst.com/schemas/narrative-risk/governance-workflow/2.0.0",
    "https://sustainablecatalyst.com/schemas/narrative-risk/handoff/catalyst-canvas-stakeholders/2.0.0",
    "https://sustainablecatalyst.com/schemas/narrative-risk/handoff/catalyst-data-source/2.0.0",
    "https://sustainablecatalyst.com/schemas/narrative-risk/handoff/knowledge-library-source/2.0.0",
    "https://sustainablecatalyst.com/schemas/narrative-risk/handoff/site-intelligence-monitoring/2.0.0",
    "https://sustainablecatalyst.com/schemas/narrative-risk/input/2.0.0",
    "https://sustainablecatalyst.com/schemas/narrative-risk/institutional-workspace/2.0.0",
    "https://sustainablecatalyst.com/schemas/narrative-risk/integration-route/2.0.0",
    "https://sustainablecatalyst.com/schemas/narrative-risk/method-snapshot/2.0.0",
    "https://sustainablecatalyst.com/schemas/narrative-risk/monitoring-alert/2.0.0",
    "https://sustainablecatalyst.com/schemas/narrative-risk/monitoring-comparison/2.0.0",
    "https://sustainablecatalyst.com/schemas/narrative-risk/monitoring-snapshot/2.0.0",
    "https://sustainablecatalyst.com/schemas/narrative-risk/narrative-map/2.0.0",
    "https://sustainablecatalyst.com/schemas/narrative-risk/performance-report/2.0.0",
    "https://sustainablecatalyst.com/schemas/narrative-risk/platform-event/2.0.0",
    "https://sustainablecatalyst.com/schemas/narrative-risk/platform-handoff/2.0.0",
    "https://sustainablecatalyst.com/schemas/narrative-risk/platform-profile/2.0.0",
    "https://sustainablecatalyst.com/schemas/narrative-risk/privacy-policy/2.0.0",
    "https://sustainablecatalyst.com/schemas/narrative-risk/production-readiness/2.0.0",
    "https://sustainablecatalyst.com/schemas/narrative-risk/public-embed/2.0.0",
    "https://sustainablecatalyst.com/schemas/narrative-risk/publication-package/2.0.0",
    "https://sustainablecatalyst.com/schemas/narrative-risk/record/2.0.0",
    "https://sustainablecatalyst.com/schemas/narrative-risk/retention-assessment/2.0.0",
    "https://sustainablecatalyst.com/schemas/narrative-risk/review-assignment/2.0.0",
    "https://sustainablecatalyst.com/schemas/narrative-risk/review-event/2.0.0",
    "https://sustainablecatalyst.com/schemas/narrative-risk/review-template/2.0.0",
    "https://sustainablecatalyst.com/schemas/narrative-risk/revision/2.0.0",
    "https://sustainablecatalyst.com/schemas/narrative-risk/saved-view/2.0.0",
    "https://sustainablecatalyst.com/schemas/narrative-risk/scenario-result/2.0.0",
    "https://sustainablecatalyst.com/schemas/narrative-risk/scenario/2.0.0",
    "https://sustainablecatalyst.com/schemas/narrative-risk/security-report/2.0.0",
    "https://sustainablecatalyst.com/schemas/narrative-risk/sensitivity-analysis/2.0.0",
    "https://sustainablecatalyst.com/schemas/narrative-risk/stakeholder-actor/2.0.0",
    "https://sustainablecatalyst.com/schemas/narrative-risk/stakeholder-consequence/2.0.0",
    "https://sustainablecatalyst.com/schemas/narrative-risk/stakeholder-incentive/2.0.0",
    "https://sustainablecatalyst.com/schemas/narrative-risk/stakeholder-intelligence/2.0.0",
    "https://sustainablecatalyst.com/schemas/narrative-risk/stakeholder-pressure/2.0.0",
    "https://sustainablecatalyst.com/schemas/narrative-risk/stakeholder-relationship/2.0.0",
    "https://sustainablecatalyst.com/schemas/narrative-risk/watchlist/2.0.0",
    "https://sustainablecatalyst.com/schemas/narrative-risk/workspace-bundle/2.0.0"
  ],
  "runtime_contracts": [
    "python",
    "browser-javascript",
    "wordpress-php",
    "sqlite3"
  ],
  "migration_sources": [
    "1.0.1",
    "1.1.0",
    "1.2.0",
    "1.3.0",
    "1.4.0",
    "1.5.0",
    "1.6.0",
    "1.7.0",
    "1.8.0",
    "1.9.0",
    "1.10.0"
  ],
  "profile_sha256": "7a8c8e8fe122ff40c137f8dd534c5a4075eac0ddbc775bef8041cc6c12b9ac80"
}
